{
  "android_root": "D:/Myfiles/a2h/arkts-migration/harmony-migration-toolkit",
  "gradle_modules": [],
  "manifest": {
    "application_id": "com.verifyfix.minimal",
    "launcher_activity_class": "MainActivity",
    "launcher_activity_qualified": "com.verifyfix.minimal.MainActivity",
    "package": "com.verifyfix.minimal"
  },
  "navigation_summary": {
    "activity_nodes": 2,
    "dialog_nodes": 0,
    "total_edges": 1,
    "total_nodes": 2
  },
  "schema_version": "1.0",
  "screens": [
    {
      "class_name": "MainActivity",
      "kind": "activity",
      "layout": "activity_main",
      "noise": "clean"
    },
    {
      "class_name": "SettingsActivity",
      "kind": "activity",
      "layout": "activity_settings",
      "noise": "clean"
    }
  ],
  "spec_tools_artifacts": {
    "ground_truth": "ground_truth.json",
    "navigation_graph": "navigation_graph.json",
    "source_findings": "source_findings.json",
    "specs_dir": "specs",
    "static_xml": "static_xml.json"
  },
  "ui_fidelity": "mixed"
}
